{
  "schemaVersion": "1.0",
  "resourceType": "schedule",
  "resourceId": "community-events.schedule",
  "version": "2026.08.26.1",
  "routinePoints": [
    { "routinePointId": "day-start", "label": "Day starts", "sort": 100, "suggestedLocalTime": "09:00" }
  ],
  "timeAnchors": [
    {
      "anchorId": "morning",
      "label": "Morning",
      "sort": 100,
      "relativeTo": { "routinePointId": "day-start", "offsetMinutes": 0 }
    },
    { "anchorId": "flexible", "label": "Any time", "sort": 900 }
  ],
  "steps": [
    {
      "stepId": "event-preparation",
      "order": 1,
      "title": "Event preparation",
      "summary": "Choose the tasks that are useful for your event.",
      "itemIds": ["events.schedule.bring-water", "events.schedule.review-accessibility"]
    }
  ],
  "items": [
    {
      "scheduleId": "events.schedule.bring-water",
      "stepId": "event-preparation",
      "actionId": "events.actions.bring-water",
      "title": "Pack a water bottle",
      "actionKind": "task",
      "timeAnchor": "morning",
      "sort": 100,
      "activation": { "scope": "from-step", "seriesId": "event-kit" },
      "visibility": {
        "any": [
          { "choiceId": "event-interests", "operator": "contains", "value": "workshop" },
          { "choiceId": "event-interests", "operator": "contains", "value": "market" }
        ]
      },
      "reminder": {
        "mode": "user-configured",
        "userConfirmationRequired": true,
        "shortText": "Review an upcoming event task"
      }
    },
    {
      "scheduleId": "events.schedule.review-accessibility",
      "stepId": "event-preparation",
      "actionId": "events.actions.review-accessibility",
      "title": "Review accessibility information",
      "actionKind": "reference",
      "timeAnchor": "flexible",
      "sort": 200,
      "reminder": {
        "mode": "user-configured",
        "userConfirmationRequired": true,
        "shortText": "Review an upcoming event task"
      }
    }
  ]
}
